candidate_id,short_id,verdict,rescue_rank,trade_count,profit_factor,fee_2x_pf,fee_3x_pf,fee_5x_pf,max_drawdown,asset_count,compounding_status,reason
KELL_WEDGE,KELL,NEEDS_NATIVE_DATA,5,17,3.595616,3.399304,3.219458,2.90152,-7.313073,3,SAFE,only 17 trades and Claude contract audit says the previous proxy dropped Kell cycle preconditions
CRABEL_RANGE_EXPANSION,CRABEL,NEEDS_NATIVE_DATA,1,7822,1.772742,1.609039,1.462264,1.212805,-90.065624,17,OVERFLOW_RISK_CAPPED,Claude contract audit says canonical Crabel is intraday/session based; crypto-daily prior backtest is not a fair test
SLINGSHOT_EMA_PULLBACK,SLINGSHOT,WEAK_STAGE3_CODE_VERIFIED,2,856,1.749484,1.720543,1.692191,1.637186,-99.969194,17,OVERFLOW_RISK_CAPPED,"coded contract is simple enough, but OOS PF broke below 1 and drawdown is unacceptable"
BIGBELUGA_RSI_DIVERGENCE_CHOCH_ATR,BIGBELUGA,NEEDS_CONTRACT_REWRITE,4,739,1.72521,1.691923,1.659414,1.596696,-99.961612,17,OVERFLOW_RISK_CAPPED,"previous code uses RSI recovery plus CHoCH, not a strict divergence contract"
MARTIN_LUKE_PULLBACK,MARTIN,NEEDS_NATIVE_DATA,6,326,1.528889,1.504029,1.479706,1.432573,-99.350673,17,SAFE,AVWAP/relative strength context is equity-native; crypto proxy OOS failed
LINDA_5SMA_PULLBACK,LINDA,NEEDS_NATIVE_DATA,3,874,1.355673,1.310809,1.267055,1.18294,-98.33831,17,SAFE,"RS is proxied, not native; base edge is weak and drawdown is extreme"
